Microsoft Windows [Version 10.0.26120.961]
(c) Microsoft Corporation. All rights reserved.

C:\Users\varan>mysql --version
mysql  Ver 8.0.37 for Win64 on x86_64 (MySQL Community Server - GPL)

C:\Users\varan>mysql -h localhost -u root -p
Enter password: *********
Welcome to the MySQL monitor.  Commands end with ; or \g.
Your MySQL connection id is 14
Server version: 8.0.37 MySQL Community Server - GPL

Copyright (c) 2000, 2024, Oracle and/or its affiliates.

Oracle is a registered trademark of Oracle Corporation and/or its
affiliates. Other names may be trademarks of their respective
owners.

Type 'help;' or '\h' for help. Type '\c' to clear the current input statement.

mysql> show databases;
+--------------------+
| Database           |
+--------------------+
| information_schema |
| mysql              |
| performance_schema |
| sys                |
+--------------------+
4 rows in set (0.00 sec)

mysql> use mysql
Database changed
mysql> show tables;
+------------------------------------------------------+
| Tables_in_mysql                                      |
+------------------------------------------------------+
| columns_priv                                         |
| component                                            |
| db                                                   |
| default_roles                                        |
| engine_cost                                          |
| func                                                 |
| general_log                                          |
| global_grants                                        |
| gtid_executed                                        |
| help_category                                        |
| help_keyword                                         |
| help_relation                                        |
| help_topic                                           |
| innodb_index_stats                                   |
| innodb_table_stats                                   |
| ndb_binlog_index                                     |
| password_history                                     |
| plugin                                               |
| procs_priv                                           |
| proxies_priv                                         |
| replication_asynchronous_connection_failover         |
| replication_asynchronous_connection_failover_managed |
| replication_group_configuration_version              |
| replication_group_member_actions                     |
| role_edges                                           |
| server_cost                                          |
| servers                                              |
| slave_master_info                                    |
| slave_relay_log_info                                 |
| slave_worker_info                                    |
| slow_log                                             |
| tables_priv                                          |
| time_zone                                            |
| time_zone_leap_second                                |
| time_zone_name                                       |
| time_zone_transition                                 |
| time_zone_transition_type                            |
| user                                                 |
+------------------------------------------------------+
38 rows in set (0.02 sec)

mysql> create table studs_data(sno int(3),sname varchar(20));
Query OK, 0 rows affected, 1 warning (0.03 sec)

mysql> desc studs_data;
+-------+-------------+------+-----+---------+-------+
| Field | Type        | Null | Key | Default | Extra |
+-------+-------------+------+-----+---------+-------+
| sno   | int         | YES  |     | NULL    |       |
| sname | varchar(20) | YES  |     | NULL    |       |
+-------+-------------+------+-----+---------+-------+
2 rows in set (0.00 sec)

mysql> insert into studs_data values(101,'vvsv');
Query OK, 1 row affected (0.02 sec)

mysql> insert into studs_data values(102,'vvsvignesh');
Query OK, 1 row affected (0.01 sec)

mysql> select * from studs_data;
+------+------------+
| sno  | sname      |
+------+------------+
|  101 | vvsv       |
|  102 | vvsvignesh |
+------+------------+
2 rows in set (0.00 sec)

mysql> alter table studs_data add branch varchar(4);
Query OK, 0 rows affected (0.07 sec)
Records: 0  Duplicates: 0  Warnings: 0

mysql> select * from studs_data;
+------+------------+--------+
| sno  | sname      | branch |
+------+------------+--------+
|  101 | vvsv       | NULL   |
|  102 | vvsvignesh | NULL   |
+------+------------+--------+
2 rows in set (0.00 sec)

mysql> update studs_data set branch='CSE' where sno=102;
Query OK, 1 row affected (0.01 sec)
Rows matched: 1  Changed: 1  Warnings: 0

mysql> select * from studs_data;
+------+------------+--------+
| sno  | sname      | branch |
+------+------------+--------+
|  101 | vvsv       | NULL   |
|  102 | vvsvignesh | CSE    |
+------+------------+--------+
2 rows in set (0.00 sec)

mysql> delete from studs_data where sno=101;
Query OK, 1 row affected (0.01 sec)

mysql> select * from studs_data;
+------+------------+--------+
| sno  | sname      | branch |
+------+------------+--------+
|  102 | vvsvignesh | CSE    |
+------+------------+--------+
1 row in set (0.00 sec)

mysql> truncate table studs_data;
Query OK, 0 rows affected (0.04 sec)

mysql> select * from studs_data;
Empty set (0.00 sec)

mysql> insert into studs_data values(101,'vvsv');
ERROR 1136 (21S01): Column count doesn't match value count at row 1

mysql> insert into studs_data values(101,'vvsv','CSE');
Query OK, 1 row affected (0.01 sec)

mysql> select * from studs_data;
+------+-------+--------+
| sno  | sname | branch |
+------+-------+--------+
|  101 | vvsv  | CSE    |⁮
+------+-------+--------+⁯
1 row in set (0.00 sec)

mysql> insert into studs_data values(102,'vvsvignesh','ECE');
Query OK, 1 row affected (0.01 sec)

mysql> select * from studs_data;
+------+------------+--------+
| sno  | sname      | branch |
+------+------------+--------+
|  101 | vvsv       | CSE    |
|  102 | vvsvignesh | ECE    |
+------+------------+--------+
2 rows in set (0.00 sec)

mysql>
